AdvESL_MeasureableSkills_Participant_POP_MSG,AdvESL_MeasureableSkills_IndividualsServed,AdvESL_MeasureableSkills_Participants12+Hours,AdvESL_MeasureableSkills_ParticipServed,AdvESL_MeasureableSkills_POPs,AdvESL_MeasureableSkills_AHSGrad,AdvESL_MeasureableSkills_HSE,"AdvESL_MeasureableSkills_Postsecondary
Enrollment",AdvESL_MeasureableSkills_Post-test,AdvESL_MeasureableSkills_MSG,Beg_ESL_Students,Beg_ESL_PCTProgress,LowBeg_ESL_Students,LowBeg_ESL_PCTProgress,HighBeg_ESL_Students,HighBeg_ESL_PCTProgress,LowInt_ESL_Students,LowInt_ESL_PCTProgress,HighInt_ESL_Students,HighInt_ESL_PCTProgress,Advanced_ESL_Students,Advanced_ESL_PCTProgress,"Basic_Skills_Students
(Denominator)","Basic_Skills_CompletingLevel
LEVEL",Basic_Skills_PCTCompleting,Beg_ABE_Lit_Students,Beg_ABE_Lit_PCTProgress,Beg_BasicEd_Students,Beg_BasicEd_PCTProgress,LowInt_BasicEd_Students,LowInt_BasicEd_PCTProgress,HighInt_BasicEd_Students,HighInt_BasicEd_PCTProgress,Low_AdultSecondary_Students,Low_AdultSecondary_PCTProgress,BegABELit_Participant_POP_MSG,BegABELit_IndividualsServed,BegABELit_Participants12+ Hours,BegABELit_Particip/Served,BegABELit_POPs,BegABELit_AHSGrad,BegABELit_HSE,BegABELit_Postsecondary,BegABELit_Posttest,BegABELit_MSG,BegBasicEd_Participant_POP_MSG,BegBasicEd_IndividualsServed,BegBasicEd_Participants12+ Hours,BegBasicEd_Particip/Served,BegBasicEd_POPs,BegBasicEd_AHSGrad,BegBasicEd_HSE,BegBasicEd_Postsecondary,BegBasicEd_Posttest,BegBasicEd_MSG,BegESLLit_Participant_POP_MSG,BegESLLit_IndividualsServed,BegESLLit_Participants12+ Hours,BegESLLit_Particip/Served,BegESLLit_POPs,BegESLLit_HSE,BegESLLit_Postsecondary,BegESLLit_Posttest,BegESLLit_MSG,Transfer30+Hours_Students,Transfer30+Hours_PCTGreater2.25,TransferAssociateDeg_Students,TransferAssociateDegree_PCTGreater2.25,Transfer_TotalStudents2016,TransferTotal_NumberGreater2.252016,TransferTotal_PCTGreater2.252016,BASIC_SKILLS,FIT,HRD,NON_OCC_SS,OCC_RB,OCC_SS,Annual_ConEd_USnBdCupCount,"Annual Undup
(Curr and ConEd)",Unnamed: 1,"12 HOURS ATTEMPTED
(Denominator)","12 HOURS SUCCESSFUL
(Numerator)",16-17,15-16,"% SUCCESSFUL
14-15",13-14,13-Dec,NumStudents1stYearSuccess_Age-15,PCT1stYearSuccess_Age-15,NumStudents1stYearSuccess_Age16-17,PCT1stYearSuccess_Age16-17,NumStudents1stYearSuccess_Age18,PCT1stYearSuccess_Age18,NumStudents1stYearSuccess_Age19-24,PCT1stYearSuccess_Age19-24,NumStudents1stYearSuccess_Age25-39,PCT1stYearSuccess_Age25-39,NumStudents1stYearSuccess_Age40+,PCT1stYearSuccess_Age40+,AAF_1stYearSuccessNumStudents,AAF_1stYearSuccessPCT,AAM_1stYearSuccessNumStudents,AAM_1stYearSuccessPCT,CF_1stYearSuccessNumStudents,CF_1stYearSuccessPCT,CM_1stYearSuccessNumStudents,CM_1stYearSuccessPCT,HF_1stYearSuccessNumStudents,HF_1stYearSuccessPCT,HM_1stYearSuccessNumStudents,HM_1stYearSuccessPCT,OF_1stYearSuccessNumStudents,OF_1stYearSuccessPCT,OM_1stYearSuccessNumStudents,OM_1stYearSuccessPCT,HighAdultSecEd_Participant_POP_MSG,HighAdultSecEd_IndividualsServed,HighAdultSecEd_Participants12+ Hours,HighAdultSecEd_Particip/Served,HighAdultSecEd_POPs,HighAdultSecEd_AHSGrad,HighAdultSecEd_HSE,HighAdultSecEd_Postsecondary,HighAdultSecEd_Posttest,HighAdultSecEd_MSG,HighBegESL_Participant_POP_MSG,HighBegESL_IndividualsServed,HighBegESL_Participants12+ Hours,HighBegESL_Particip/Served,HighBegESL_POPs,HighBegESL_HSE,HighBegESL_Postsecondary,HighBegESL_Posttest,HighBegESL_MSG,HighIntBasicEd_Participant_POP_MSG,HighIntBasicEd_IndividualsServed,HighIntBasicEd_Participants12+ Hours,HighIntBasicEd_Particip/Served,HighIntBasicEd_POPs,HighIntBasicEd_AHSGrad,HighIntBasicEd_HSE,HighIntBasicEd_Postsecondary,HighIntBasicEd_Posttest,HighIntBasicEd_MSG,HighInt_ESLMeasureableSkills_Participant_POP_MSG,HighInt_ESLMeasureableSkills_IndividualsServed,HighInt_ESLMeasureableSkills_Participants12+Hours,HighInt_ESLMeasureableSkills_Particip/Served,HighInt_ESLMeasureableSkills_POPs,HighInt_ESLMeasureableSkills_AHSGrad,HighInt_ESLMeasureableSkills_HSE,HighInt_ESLMeasureableSkills_Postsecondary,HighInt_ESLMeasureableSkills_Posttest,HighInt_ESLMeasureableSkills_MSG,AviationGeneral_NumTest2017,AviationGeneral_PCTPassing2017,AviationGeneral_PCTPassing2016,AviationGeneral_PCTPassing2015,AviationGeneral_PCTPassing2014,AviationAirframe_NumTest2017,AviationAirframe_PCTPassing2017,AviationAirframe_PCTPassing2016,AviationAirframe_PCTPassing2015,AviationAirframe_PCTPassing2014,AviationPowerPlant_NumTest2017,AviationPowerPlant_NumTest2017.1,AviationPowerPlant_NumTest2015,AviationPowerPlant_NumTest2014,Massage_NumTest2017,Massage_NumTest2017.1,Massage_NumTest2016,Massage_NumTest2015,Massage_NumTest2014,NucMedTech_NumTest2017,NucMedTech_PCTPassing2016,RadiationTherapy_NumTest2017,RadiationTherapy_PCTPassing2017,RadiationTherapy_PCTPassing2014,Radiography_NumTest2017,Radiography_PCTPassing2017,Radiography_PCTPassing2016,Radiography_PCTPassing2015,Radiography_PCTPassing2014,RealEstateSales_NumTest2017,RealEstateSales_PCTPassing2017,RealEstateSales_PCTPassing2016,RealEstateSales_PCTPassing2015,RealEstateSales_PCTPassing2014,CosmeticApprentice_NumTest2017,CosmeticApprentice_PCTPassing2017,CosmeticApprentice_PCTPassing2016,CosmeticApprentice_PCTPassing2015,CosmeticApprentice_PCTPassing2014,Cosmetology_NumTest2017,Cosmetology_PCTPassing2017,Cosmetology_PCTPassing2016,Cosmetology_PCTPassing2015,Cosmetology_PCTPassing2014,Esthetician_NumTest2017,Esthetician_PCTPassing2017,Esthetician_PCTPassing2016,Esthetician_PCTPassing2015,Esthetician_PCTPassing2014,CosmeticInstructor_NumTest2017,Manicurist_NumTest2017,Manicurist_PCTPassing2017,Manicurist_PCTPassing2016,Manicurist_PCTPassing2015,Manicurist_PCTPassing2014,Blet_NumTest2017,Blet_PCTPassing2017,Blet_PCTPassing2016,Blet_PCTPassing2015,Blet_PCTPassing2014,DetentionOfficer_NumTest2017,DetentionOfficer_PCTPassing2017,DetentionOfficer_PCTPassing2016,DetentionOfficer_PCTPassing2015,DetentionOfficer_PCTPassing2014,EMTBasic_NumTest2017,EMTBasic_PCTPassing2017,EMTBasic_PCTPassing2016,EMTBasic_PCTPassing2015,EMTBasic_PCTPassing2014,EMTIntermediate_NumTest2017,EMTIntermediate_PCTPassing2017,EMTIntermediate_PCTPassing2016,EMTIntermediate_PCTPassing2015,EMTIntermediate_PCTPassing2014,EMTParamedic_NumTest2017,EMTParamedic_PCTPassing2017,EMTParamedic_PCTPassing2016,EMTParamedic_PCTPassing2015,EMTParamedic_PCTPassing2014,DentalHygiene_NumTest2017,DentalHygiene_PCTPassing2017,DentalHygiene_PCTPassing2016,DentalHygiene_PCTPassing2015,DentalHygiene_PCTPassing2014,PhysicalTherapistAsst_NumTest2017,PhysicalTherapistAsst_PCTPassing2017,PhysicalTherapistAsst_PCTPassing2016,PhysicalTherapistAsst_PCTPassing2015,PhysicalTherapistAsst_PCTPassing2014,PracticalNursing_NumTest2017,PracticalNursing_PCTPassing2017,PracticalNursing_PCTPassing2016,PracticalNursing_PCTPassing2015,PracticalNursing_PCTPassing2014,RegisteredNursing_NumTest2017,RegisteredNursing_PCTPassing2017,RegisteredNursing_PCTPassing2016,RegisteredNursing_PCTPassing2015,RegisteredNursing_PCTPassing2014,VetMedTech_NumTest2017,VetMedTech_PCTPassing2014,LowAdultSecEd_Participant_POP_MSG,LowAdultSecEd_IndividualsServed,LowAdultSecEd_Participants12+ Hours,LowAdultSecEd_Particip/Served,LowAdultSecEd_POPs,LowAdultSecEd_AHSGrad,LowAdultSecEd_HSE,LowAdultSecEd_Postsecondary,LowAdultSecEd_AHSCredits,LowAdultSecEd_Posttest,LowAdultSecEd_MSG,LowBegESL_Participant_POP_MSG,LowBegESL_IndividualsServed,LowBegESL_Participants12+ Hours,LowBegESL_Particip/Served,LowBegESL_POPs,LowBegESL_HSE,LowBegESL_Postsecondary,LowBegESL_Posttest,LowBegESL_MSG,LowIntBasicEd_Participant_POP_MSG,LowIntBasicEd_IndividualsServed,LowIntBasicEd_Participants12+ Hours,LowIntBasicEd_Particip/Served,LowIntBasicEd_POPs,LowIntBasicEd_AHSGrad,LowIntBasicEd_HSE,LowIntBasicEd_Postsecondary,LowIntBasicEd_Posttest,LowIntBasicEd_MSG,LowIntESL_Participant_POP_MSG,LowIntESL_IndividualsServed,"LowIntESL_Participants
(12+ Hours)",LowIntESL_Particip/Served,LowIntESL_POPs,LowIntESL_HSE,LowIntESL_Postsecondary,LowIntESL_Posttest,LowIntESL_MSG,Basic_Skills_Progress,Credit_English_Success,Credit_Math_Success,First_Year_Progression,Curr_Completion_Rate,Licensure_Passing_Rate,Transfer_Performance,MEEL,ACABE,ABLBA,BBL,FALL_COHORT,CRED_ENG_ENROLLMENT,CREDIT_ENG_SUCCESS,ENG_PCT_Successful2015,ENG_PCT_Successful2014,ENG_PCT_Successful2013,ENG_PCT_Successful2012,"FALL COHORT
(Denominator)",CRED MAT ENROLLMENT,"CREDIT MAT SUCCESS
(Numerator)",2015,"% SUCCESSFUL
2014 2013",Unnamed: 6,2012,English_Students_Age-15,English_SuccessPCT_Age-15,English_Students_Age16-17,English_SuccessPCT_Age16-17,English_Students_Age18,English_SuccessPCT_Age18,English_Students_Age19-24,English_SuccessPCT_Age19-24,English_Students_Age25-39,English_SuccessPCT_Age29-35,English_Students_Age40+,English_SuccessPCT_Age40+,Math_Students_Age-15,Math_SuccessPCT_Age-15,Math_Students_Age16-17,Math_SuccessPCT_Age16-17,Math_Students_Age18,Math_SuccessPCT_Age18,Math_Students_Age19-24,Math_SuccessPCT_Age19-24,Math_Students_Age25-39,Math_SuccessPCT_Age29-35,Math_Students_Age40+,Math_SuccessPCT_Age40+,Associates_Total,Associates_Men_Number,Accosiates_Men_Percent,Associates_Women_Number,Associates_Women_Percent,AwardLess1Year_Total,AwardLess1Year_Men_Number,AwardLess1Year_Men_Percent,AwardLess1Year_Women_Number,AwardLess1Year_Women_Percent,AwardLess2Year_Total,AwardLess2Year_Men_Number,AwardLess2Year_Men_Percent,AwardLess2Year_Women_Number,AwardLess2Year_Women_Percent,Certificate_Total,Certificate_Men_Number,Certificate_Women_Number,Certificate_Women_Percent,Full time Men,Full time Women,Part time Men,Part time Total,FirstTimeFullTimeUndergradsTotal,Financial_Aid_AnyAid,Financial_Aid_FedGrants,Financial_Aid_StateLocalGrants,StateLocalGrants_Avg,Financial_Aid_InstitutionalGrants,InstitutionalGrants_Avg,Financial_Aid_Loans,Loans_Avg,Completers_150time_Grand total,Completers_150time_men,Completers_150time_women,Completers_150time_American Indian or Alaska Native,Completers_150time_Asian,Completers_150time_Black or African American,Completers_150time_Hispanic,Completers_150time_Native Hawaiian or Other Pacific Islander,Completers_150time_White,Completers_150time_Two or more races,Completers_150time_Race/ethnicity unknown,Completers_150time_Nonresident alien,Grand total women,American Indian or Alaska Native total,Asian total,Black or African American total,Hispanic total,Native Hawaiian or Other Pacific Islander total,White total,Two or more races total,Race/ethnicity unknown total,Nonresident alien total,Full-time retention rate  2016,Part-time retention rate  2016,WhiteM_PCT086004,WhiteM_PCT086017,WhiteM_PCT086055,WhiteM_PCT086090,WhiteM_PCT086093,AsianF_PCT086130,AsianF_PCT086143,AsianF_PCT086181,AsianF_PCT086216,AsianF_PCT086219,AsianM_PCT086004,AsianM_PCT086017,AsianM_PCT086055,AsianM_PCT086090,AsianM_PCT086093,BlackF_PCT086130,BlackF_PCT086143,BlackF_PCT086181,BlackF_PCT086216,BlackF_PCT086219,BlackM_PCT086004,BlackM_PCT086017,BlackM_PCT086055,BlackM_PCT086090,BlackM_PCT086093,HispanicF_PCT086130,HispanicF_PCT086143,HispanicF_PCT086181,HispanicF_PCT086216,HispanicF_PCT086219,HispanicM_PCT086004,HispanicM_PCT086017,HispanicM_PCT086055,HispanicM_PCT086090,HispanicM_PCT086093,IndianF_PCT086130,IndianF_PCT086143,IndianF_PCT086181,IndianF_PCT086216,IndianF_PCT086219,IndianM_PCT086004,IndianM_PCT086017,IndianM_PCT086055,IndianM_PCT086090,IndianM_PCT086093,OtherF_PCT086130,OtherF_PCT086143,OtherF_PCT086181,OtherF_PCT086216,OtherF_PCT086219,OtherM_PCT086004,OtherM_PCT086017,OtherM_PCT086055,OtherM_PCT086090,OtherM_PCT086093,TotalF_PCT086130,TotalF_PCT086143,TotalF_PCT086181,TotalF_PCT086216,TotalF_PCT086219,TotalM_PCT086004,TotalM_PCT086017,TotalM_PCT086055,TotalM_PCT086090,TotalM_PCT086093,TwoRaceF_PCT086130,TwoRaceF_PCT086143,TwoRaceF_PCT086181,TwoRaceF_PCT086216,TwoRaceF_PCT086219,TwoRaceM_PCT086004,TwoRaceM_PCT086017,TwoRaceM_PCT086055,TwoRaceM_PCT086090,TwoRaceM_PCT086093,WhiteF_PCT086130,WhiteF_PCT086143,WhiteF_PCT086181,WhiteF_PCT086216,WhiteF_PCT086219,Number of returns,Number of single returns,Number of joint returns,Number of head of household returns,Number with paid preparer's signature,Number of exemptions,Number of dependents,Number of volunteer prepared returns [2]_Total,Number of volunteer prepared returns [2]_Number of volunteer income tax assistance (VITA) prepared returns,Number of volunteer prepared returns [2]_Number of tax counseling for the elderly (TCE) prepared returns,"Number of volunteer prepared returns [2]_Number of volunteer prepared 
returns with
Earned Income Credit",Number of refund anticipation loan returns,Number of refund anticipation check returns,Number of elderly returns [3],Adjusted gross income (AGI) [4],Total income_Number of returns,Total income_Amount,Salaries and wages in AGI_Number of returns,Salaries and wages in AGI_Amount,Taxable interest_Number of returns,Taxable interest_Amount,Ordinary dividends_Number of returns,Ordinary dividends_Amount,Qualified dividends [5]_Number of returns,Qualified dividends [5]_Amount,"State and local income tax refunds
_Number of returns","State and local income tax refunds
_Amount","Business or profession
net income (less loss)_Number of returns","Business or profession
net income (less loss)_Amount",Net capital gain (less loss) in AGI_Number of returns,Net capital gain (less loss) in AGI_Amount,"Taxable individual retirement
arrangement distributions_Number of returns","Taxable individual retirement
arrangement distributions_Amount",Pensions and annuities in AGI_Number of returns,Pensions and annuities in AGI_Amount,"Number of 
farm returns",Unemployment compensation [6]_Number of returns,Unemployment compensation [6]_Amount,Taxable Social Security benefits_Number of returns,Taxable Social Security benefits_Amount,Partnership/S-corp net income (less loss)_Number of returns,Partnership/S-corp net income (less loss)_Amount,Total statuory adjustments_Number of returns,Total statuory adjustments_Amount,Educator expenses_Number of returns,Educator expenses_Amount,Self-employed (Keogh) retirement plans_Number of returns,Self-employed (Keogh) retirement plans_Amount,Self-employed health insurance deduction_Number of returns,Self-employed health insurance deduction_Amount,Individual retirement arrangement payments_Number of returns,Individual retirement arrangement payments_Amount,Student loan interest deduction_Number of returns,Student loan interest deduction_Amount,Tuition and fees deduction_Number of returns,Tuition and fees deduction_Amount,Domestic production activities deduction_Number of returns,Domestic production activities deduction_Amount,Total itemized deductions_Number of returns,Total itemized deductions_Amount,Total itemized deductions_Amount of AGI,"Total medical and dental 
expenses deduction_Number of returns","Total medical and dental 
expenses deduction_Amount",State and local income taxes_Number of returns,State and local income taxes_Amount,State and local general sales taxes_Number of returns,State and local general sales taxes_Amount,Real estate taxes_Number of returns,Real estate taxes_Amount,Personal property taxes_Number of returns,Personal property taxes_Amount,Total taxes paid_Number of returns,Total taxes paid_Amount,Home mortgage interest paid _Number of returns,Home mortgage interest paid _Amount,"Home mortgage interest paid 
from personal seller_Number of returns","Home mortgage interest paid 
from personal seller_Amount",Deductible points_Number of returns,Deductible points_Amount,Qualified mortgage insurance premiums_Number of returns,Qualified mortgage insurance premiums_Amount,Investment interest paid_Number of returns,Investment interest paid_Amount,Total charitable contributions_Number of returns,Total charitable contributions_Amount,Net limited miscellaneous deduction_Number of returns,Net limited miscellaneous deduction_Amount,"Other non-limited 
miscellaneous deduction_Number of returns","Other non-limited 
miscellaneous deduction_Amount",Taxable income_Number of returns,Taxable income_Amount,Income tax before credits_Number of returns,Income tax before credits_Amount,Alternative minimum tax_Number of returns,Alternative minimum tax_Amount,"Excess advance 
premium tax credit repayment_Number of returns","Excess advance 
premium tax credit repayment_Amount",Total tax credits_Number of returns,Total tax credits_Amount,Foreign tax credit_Number of returns,Foreign tax credit_Amount,Child and dependent care credit_Number of returns,Child and dependent care credit_Amount,Nonrefundable education credit_Number of returns,Nonrefundable education credit_Amount,Retirement savings contributions credit_Number of returns,Retirement savings contributions credit_Amount,Child tax credit_Number of returns,Child tax credit_Amount,Residential energy tax credit_Number of returns,Residential energy tax credit_Amount,Self-employment tax_Number of returns,Self-employment tax_Amount,Total premium tax credit_Number of returns,Total premium tax credit_Amount,Advance premium tax credit_Number of returns,Advance premium tax credit_Amount,"Health care individual 
responsibility payment_Number of returns","Health care individual 
responsibility payment_Amount",Total tax payments_Number of returns,Total tax payments_Amount,Earned income credit [7]_Number of returns,Earned income credit [7]_Amount,"Excess earned income credit 
(refundable) [8]_Number of returns","Excess earned income credit 
(refundable) [8]_Amount",Additional child tax credit_Number of returns,Additional child tax credit_Amount,Refundable education credit_Number of returns,Refundable education credit_Amount,Net premium tax credit_Number of returns,Net premium tax credit_Amount,Income tax [9]_Number of returns,Income tax [9]_Amount,Total tax liability [10]_Number of returns,Total tax liability [10]_Amount,Total additional Medicare tax_Number of returns,Total additional Medicare tax_Amount,Net investment income tax_Number of returns,Net investment income tax_Amount,Tax due at time of filing [11]_Number of returns,Tax due at time of filing [11]_Amount,Overpayments refunded [12]_Number of returns,Overpayments refunded [12]_Amount,"$1 under $25,000 Number of Returns","$25,000 under $50,000 Number of Returns","$50,000 under $75,000 Number of Returns","$75,000 under $100,000 Number of Returns","$100,000 under $200,000 Number of Returns","$200,000 or more Number of Returns",unit_code,szip_ad,student_num,lea_avg_student_num,06_Size,Biology_Size,English II_Size,Math I_Size,lea_total_expense_num,lea_salary_expense_pct,lea_benefits_expense_pct,lea_services_expense_pct,lea_supplies_expense_pct,lea_instruct_equip_exp_pct,lea_federal_perpupil_num,lea_local_perpupil_num,lea_state_perpupil_num,st_salary_expense_pct,st_local_perpupil_num,SPG Score,EVAAS Growth Score,Overall Achievement Score,Math I Score,English II Score,Biology Score,ACT Score,ACT WorkKeys Score,Passing Math III,4-Year Cohort Graduation Rate Score,ACTCompositeScore_UNCMin_All,ACTEnglish_ACTBenchmark_All,ACTMath_ACTBenchmark_All,ACTReading_ACTBenchmark_All,ACTScience_ACTBenchmark_All,ACTSubtests_BenchmarksMet_All,ACTWorkKeys_SilverPlus_All,ACTWriting_ACTBenchmark_All,EOCBiology_CACR_All,EOCBiology_GLP_All,EOCEnglish2_CACR_All,EOCEnglish2_GLP_All,EOCMathI_CACR_All,EOCMathI_GLP_All,EOCSubjects_CACR_All,EOCSubjects_GLP_All,EOG/EOCSubjects_CACR_All,EOG/EOCSubjects_GLP_All,EOGGr6_CACR_All,EOGGr6_GLP_All,EOGMathGr6_CACR_All,EOGMathGr6_GLP_All,EOGMathGr8_CACR_All,EOGReadingGr6_CACR_All,EOGReadingGr6_GLP_All,EOGScienceGr5&8_CACR_All,EOGScienceGr5&8_GLP_All,EOGScienceGr8_GLP_All,GraduationRate_4yr_All,GraduationRate_5yr_All,ACTCompositeScore_UNCMin_Female,ACTEnglish_ACTBenchmark_Female,ACTMath_ACTBenchmark_Female,ACTReading_ACTBenchmark_Female,ACTScience_ACTBenchmark_Female,ACTSubtests_BenchmarksMet_Female,ACTWorkKeys_SilverPlus_Female,ACTWriting_ACTBenchmark_Female,EOCBiology_CACR_Female,EOCBiology_GLP_Female,EOCEnglish2_CACR_Female,EOCEnglish2_GLP_Female,EOCMathI_CACR_Female,EOCMathI_GLP_Female,EOCSubjects_CACR_Female,EOCSubjects_GLP_Female,EOG/EOCSubjects_CACR_Female,EOG/EOCSubjects_GLP_Female,EOGGr6_CACR_Female,EOGGr6_GLP_Female,EOGGr8_CACR_Female,EOGMathGr3-8_CACR_Female,EOGMathGr6_CACR_Female,EOGMathGr6_GLP_Female,EOGMathGr7_CACR_Female,EOGMathGr8_CACR_Female,EOGMathGr8_GLP_Female,EOGReadingGr6_CACR_Female,EOGReadingGr6_GLP_Female,EOGScienceGr5&8_CACR_Female,EOGScienceGr8_CACR_Female,GraduationRate_4yr_Female,GraduationRate_5yr_Female,ACTCompositeScore_UNCMin_Male,ACTEnglish_ACTBenchmark_Male,ACTMath_ACTBenchmark_Male,ACTReading_ACTBenchmark_Male,ACTScience_ACTBenchmark_Male,ACTSubtests_BenchmarksMet_Male,ACTWorkKeys_SilverPlus_Male,ACTWriting_ACTBenchmark_Male,EOCBiology_CACR_Male,EOCBiology_GLP_Male,EOCEnglish2_CACR_Male,EOCEnglish2_GLP_Male,EOCMathI_CACR_Male,EOCMathI_GLP_Male,EOCSubjects_CACR_Male,EOCSubjects_GLP_Male,EOG/EOCSubjects_CACR_Male,EOG/EOCSubjects_GLP_Male,EOGGr6_CACR_Male,EOGGr6_GLP_Male,EOGMathGr6_CACR_Male,EOGMathGr6_GLP_Male,EOGMathGr8_CACR_Male,EOGReadingGr6_CACR_Male,EOGReadingGr6_GLP_Male,EOGReadingGr8_GLP_Male,EOGScienceGr5&8_CACR_Male,GraduationRate_4yr_Male,GraduationRate_5yr_Male,ACTCompositeScore_UNCMin_AmericanIndian,ACTEnglish_ACTBenchmark_AmericanIndian,ACTMath_ACTBenchmark_AmericanIndian,ACTReading_ACTBenchmark_AmericanIndian,ACTScience_ACTBenchmark_AmericanIndian,ACTSubtests_BenchmarksMet_AmericanIndian,ACTWorkKeys_SilverPlus_AmericanIndian,ACTWriting_ACTBenchmark_AmericanIndian,EOCBiology_CACR_AmericanIndian,EOCBiology_GLP_AmericanIndian,EOCEnglish2_CACR_AmericanIndian,EOCEnglish2_GLP_AmericanIndian,EOCMathI_CACR_AmericanIndian,EOCMathI_GLP_AmericanIndian,EOCSubjects_CACR_AmericanIndian,EOCSubjects_GLP_AmericanIndian,EOG/EOCSubjects_CACR_AmericanIndian,EOG/EOCSubjects_GLP_AmericanIndian,GraduationRate_4yr_AmericanIndian,GraduationRate_5yr_AmericanIndian,ACTCompositeScore_UNCMin_Asian,ACTEnglish_ACTBenchmark_Asian,ACTMath_ACTBenchmark_Asian,ACTReading_ACTBenchmark_Asian,ACTScience_ACTBenchmark_Asian,ACTSubtests_BenchmarksMet_Asian,ACTWorkKeys_SilverPlus_Asian,ACTWriting_ACTBenchmark_Asian,EOCBiology_CACR_Asian,EOCBiology_GLP_Asian,EOCEnglish2_CACR_Asian,EOCEnglish2_GLP_Asian,EOCMathI_CACR_Asian,EOCMathI_GLP_Asian,EOCSubjects_CACR_Asian,EOCSubjects_GLP_Asian,EOG/EOCSubjects_CACR_Asian,EOG/EOCSubjects_GLP_Asian,EOGGr6_CACR_Asian,EOGGr6_GLP_Asian,EOGGr7_CACR_Asian,EOGGr7_GLP_Asian,EOGGr8_CACR_Asian,EOGGr8_GLP_Asian,EOGMathGr3-8_CACR_Asian,EOGMathGr3-8_GLP_Asian,EOGReadingGr3-8_CACR_Asian,EOGReadingGr3-8_GLP_Asian,EOGSubjects_CACR_Asian,EOGSubjects_GLP_Asian,GraduationRate_4yr_Asian,GraduationRate_5yr_Asian,ACTCompositeScore_UNCMin_Black,ACTEnglish_ACTBenchmark_Black,ACTMath_ACTBenchmark_Black,ACTReading_ACTBenchmark_Black,ACTScience_ACTBenchmark_Black,ACTSubtests_BenchmarksMet_Black,ACTWorkKeys_SilverPlus_Black,ACTWriting_ACTBenchmark_Black,EOCBiology_CACR_Black,EOCBiology_GLP_Black,EOCEnglish2_CACR_Black,EOCEnglish2_GLP_Black,EOCMathI_CACR_Black,EOCMathI_GLP_Black,EOCSubjects_CACR_Black,EOCSubjects_GLP_Black,EOG/EOCSubjects_CACR_Black,EOG/EOCSubjects_GLP_Black,EOGGr6_CACR_Black,EOGGr6_GLP_Black,EOGGr7_CACR_Black,EOGGr7_GLP_Black,EOGGr8_CACR_Black,EOGGr8_GLP_Black,EOGMathGr3-8_CACR_Black,EOGMathGr3-8_GLP_Black,EOGMathGr6_CACR_Black,EOGMathGr6_GLP_Black,EOGMathGr7_CACR_Black,EOGMathGr7_GLP_Black,EOGMathGr8_CACR_Black,EOGMathGr8_GLP_Black,EOGReadingGr3-8_CACR_Black,EOGReadingGr3-8_GLP_Black,EOGReadingGr6_CACR_Black,EOGReadingGr6_GLP_Black,EOGReadingGr7_CACR_Black,EOGReadingGr7_GLP_Black,EOGReadingGr8_CACR_Black,EOGReadingGr8_GLP_Black,EOGScienceGr5&8_CACR_Black,EOGScienceGr5&8_GLP_Black,EOGScienceGr8_CACR_Black,EOGScienceGr8_GLP_Black,EOGSubjects_CACR_Black,EOGSubjects_GLP_Black,GraduationRate_4yr_Black,GraduationRate_5yr_Black,ACTCompositeScore_UNCMin_Hispanic,ACTEnglish_ACTBenchmark_Hispanic,ACTMath_ACTBenchmark_Hispanic,ACTReading_ACTBenchmark_Hispanic,ACTScience_ACTBenchmark_Hispanic,ACTSubtests_BenchmarksMet_Hispanic,ACTWorkKeys_SilverPlus_Hispanic,ACTWriting_ACTBenchmark_Hispanic,EOCBiology_CACR_Hispanic,EOCBiology_GLP_Hispanic,EOCEnglish2_CACR_Hispanic,EOCEnglish2_GLP_Hispanic,EOCMathI_CACR_Hispanic,EOCMathI_GLP_Hispanic,EOCSubjects_CACR_Hispanic,EOCSubjects_GLP_Hispanic,EOG/EOCSubjects_CACR_Hispanic,EOG/EOCSubjects_GLP_Hispanic,EOGGr6_CACR_Hispanic,EOGGr6_GLP_Hispanic,EOGGr7_CACR_Hispanic,EOGGr7_GLP_Hispanic,EOGGr8_CACR_Hispanic,EOGGr8_GLP_Hispanic,EOGMathGr3-8_CACR_Hispanic,EOGMathGr6_CACR_Hispanic,EOGMathGr6_GLP_Hispanic,EOGMathGr7_CACR_Hispanic,EOGMathGr7_GLP_Hispanic,EOGMathGr8_CACR_Hispanic,EOGMathGr8_GLP_Hispanic,EOGReadingGr3-8_CACR_Hispanic,EOGReadingGr3-8_GLP_Hispanic,EOGReadingGr6_CACR_Hispanic,EOGReadingGr6_GLP_Hispanic,EOGReadingGr7_CACR_Hispanic,EOGReadingGr7_GLP_Hispanic,EOGReadingGr8_CACR_Hispanic,EOGReadingGr8_GLP_Hispanic,EOGScienceGr5&8_CACR_Hispanic,EOGScienceGr5&8_GLP_Hispanic,EOGScienceGr8_CACR_Hispanic,EOGScienceGr8_GLP_Hispanic,EOGSubjects_CACR_Hispanic,GraduationRate_4yr_Hispanic,GraduationRate_5yr_Hispanic,ACTCompositeScore_UNCMin_TwoorMoreRaces,ACTEnglish_ACTBenchmark_TwoorMoreRaces,ACTMath_ACTBenchmark_TwoorMoreRaces,ACTReading_ACTBenchmark_TwoorMoreRaces,ACTScience_ACTBenchmark_TwoorMoreRaces,ACTSubtests_BenchmarksMet_TwoorMoreRaces,ACTWorkKeys_SilverPlus_TwoorMoreRaces,ACTWriting_ACTBenchmark_TwoorMoreRaces,EOCBiology_CACR_TwoorMoreRaces,EOCBiology_GLP_TwoorMoreRaces,EOCEnglish2_CACR_TwoorMoreRaces,EOCEnglish2_GLP_TwoorMoreRaces,EOCMathI_CACR_TwoorMoreRaces,EOCMathI_GLP_TwoorMoreRaces,EOCSubjects_CACR_TwoorMoreRaces,EOCSubjects_GLP_TwoorMoreRaces,EOG/EOCSubjects_CACR_TwoorMoreRaces,EOG/EOCSubjects_GLP_TwoorMoreRaces,EOGGr6_CACR_TwoorMoreRaces,EOGGr6_GLP_TwoorMoreRaces,EOGGr7_CACR_TwoorMoreRaces,EOGGr7_GLP_TwoorMoreRaces,EOGGr8_CACR_TwoorMoreRaces,EOGGr8_GLP_TwoorMoreRaces,EOGMathGr3-8_CACR_TwoorMoreRaces,EOGMathGr3-8_GLP_TwoorMoreRaces,EOGReadingGr3-8_CACR_TwoorMoreRaces,EOGReadingGr3-8_GLP_TwoorMoreRaces,EOGSubjects_CACR_TwoorMoreRaces,EOGSubjects_GLP_TwoorMoreRaces,GraduationRate_4yr_TwoorMoreRaces,GraduationRate_5yr_TwoorMoreRaces,ACTCompositeScore_UNCMin_White,ACTEnglish_ACTBenchmark_White,ACTMath_ACTBenchmark_White,ACTReading_ACTBenchmark_White,ACTScience_ACTBenchmark_White,ACTSubtests_BenchmarksMet_White,ACTWorkKeys_SilverPlus_White,ACTWriting_ACTBenchmark_White,EOCBiology_CACR_White,EOCBiology_GLP_White,EOCEnglish2_CACR_White,EOCEnglish2_GLP_White,EOCMathI_CACR_White,EOCMathI_GLP_White,EOCSubjects_CACR_White,EOCSubjects_GLP_White,EOG/EOCSubjects_CACR_White,EOG/EOCSubjects_GLP_White,EOGGr6_CACR_White,EOGGr6_GLP_White,EOGMathGr6_CACR_White,EOGMathGr6_GLP_White,EOGMathGr8_CACR_White,EOGMathGr8_GLP_White,EOGReadingGr6_CACR_White,EOGReadingGr6_GLP_White,EOGScienceGr5&8_CACR_White,EOGScienceGr8_CACR_White,GraduationRate_4yr_White,GraduationRate_5yr_White,ACTCompositeScore_UNCMin_EDS,ACTEnglish_ACTBenchmark_EDS,ACTMath_ACTBenchmark_EDS,ACTReading_ACTBenchmark_EDS,ACTScience_ACTBenchmark_EDS,ACTSubtests_BenchmarksMet_EDS,ACTWorkKeys_SilverPlus_EDS,ACTWriting_ACTBenchmark_EDS,EOCBiology_CACR_EDS,EOCBiology_GLP_EDS,EOCEnglish2_CACR_EDS,EOCEnglish2_GLP_EDS,EOCMathI_CACR_EDS,EOCMathI_GLP_EDS,EOCSubjects_CACR_EDS,EOCSubjects_GLP_EDS,EOG/EOCSubjects_CACR_EDS,EOG/EOCSubjects_GLP_EDS,EOGGr6_CACR_EDS,EOGGr6_GLP_EDS,EOGGr8_CACR_EDS,EOGMathGr6_CACR_EDS,EOGMathGr6_GLP_EDS,EOGMathGr7_CACR_EDS,EOGMathGr8_CACR_EDS,EOGMathGr8_GLP_EDS,EOGReadingGr6_CACR_EDS,EOGReadingGr6_GLP_EDS,EOGReadingGr8_CACR_EDS,EOGReadingGr8_GLP_EDS,EOGScienceGr5&8_CACR_EDS,EOGScienceGr5&8_GLP_EDS,EOGScienceGr8_CACR_EDS,EOGScienceGr8_GLP_EDS,GraduationRate_4yr_EDS,GraduationRate_5yr_EDS,ACTCompositeScore_UNCMin_LEP,ACTEnglish_ACTBenchmark_LEP,ACTMath_ACTBenchmark_LEP,ACTReading_ACTBenchmark_LEP,ACTScience_ACTBenchmark_LEP,ACTSubtests_BenchmarksMet_LEP,ACTWriting_ACTBenchmark_LEP,EOCBiology_CACR_LEP,EOCBiology_GLP_LEP,EOCEnglish2_CACR_LEP,EOCEnglish2_GLP_LEP,EOCMathI_CACR_LEP,EOCMathI_GLP_LEP,EOCSubjects_CACR_LEP,EOCSubjects_GLP_LEP,EOG/EOCSubjects_CACR_LEP,EOG/EOCSubjects_GLP_LEP,EOGGr6_CACR_LEP,EOGGr6_GLP_LEP,EOGGr7_CACR_LEP,EOGGr7_GLP_LEP,EOGGr8_CACR_LEP,EOGGr8_GLP_LEP,EOGMathGr3-8_CACR_LEP,EOGMathGr3-8_GLP_LEP,EOGMathGr6_CACR_LEP,EOGMathGr6_GLP_LEP,EOGMathGr7_CACR_LEP,EOGMathGr7_GLP_LEP,EOGMathGr8_CACR_LEP,EOGMathGr8_GLP_LEP,EOGReadingGr3-8_CACR_LEP,EOGReadingGr3-8_GLP_LEP,EOGReadingGr6_CACR_LEP,EOGReadingGr6_GLP_LEP,EOGReadingGr7_CACR_LEP,EOGReadingGr7_GLP_LEP,EOGReadingGr8_CACR_LEP,EOGReadingGr8_GLP_LEP,EOGScienceGr5&8_CACR_LEP,EOGScienceGr5&8_GLP_LEP,EOGScienceGr8_CACR_LEP,EOGScienceGr8_GLP_LEP,EOGSubjects_CACR_LEP,EOGSubjects_GLP_LEP,GraduationRate_4yr_LEP,GraduationRate_5yr_LEP,ACTCompositeScore_UNCMin_SWD,ACTEnglish_ACTBenchmark_SWD,ACTMath_ACTBenchmark_SWD,ACTReading_ACTBenchmark_SWD,ACTScience_ACTBenchmark_SWD,ACTSubtests_BenchmarksMet_SWD,ACTWorkKeys_SilverPlus_SWD,ACTWriting_ACTBenchmark_SWD,EOCBiology_CACR_SWD,EOCBiology_GLP_SWD,EOCEnglish2_CACR_SWD,EOCEnglish2_GLP_SWD,EOCMathI_CACR_SWD,EOCMathI_GLP_SWD,EOCSubjects_CACR_SWD,EOCSubjects_GLP_SWD,EOG/EOCSubjects_CACR_SWD,EOG/EOCSubjects_GLP_SWD,EOGGr6_CACR_SWD,EOGGr6_GLP_SWD,EOGGr7_CACR_SWD,EOGGr7_GLP_SWD,EOGGr8_CACR_SWD,EOGGr8_GLP_SWD,EOGMathGr3-8_CACR_SWD,EOGMathGr3-8_GLP_SWD,EOGMathGr6_CACR_SWD,EOGMathGr6_GLP_SWD,EOGMathGr7_CACR_SWD,EOGMathGr7_GLP_SWD,EOGMathGr8_CACR_SWD,EOGMathGr8_GLP_SWD,EOGReadingGr3-8_CACR_SWD,EOGReadingGr3-8_GLP_SWD,EOGReadingGr6_CACR_SWD,EOGReadingGr6_GLP_SWD,EOGReadingGr7_CACR_SWD,EOGReadingGr7_GLP_SWD,EOGReadingGr8_CACR_SWD,EOGReadingGr8_GLP_SWD,EOGScienceGr5&8_CACR_SWD,EOGScienceGr5&8_GLP_SWD,EOGScienceGr8_CACR_SWD,EOGScienceGr8_GLP_SWD,EOGSubjects_CACR_SWD,GraduationRate_4yr_SWD,GraduationRate_5yr_SWD,ACTCompositeScore_UNCMin_AIG,ACTEnglish_ACTBenchmark_AIG,ACTMath_ACTBenchmark_AIG,ACTReading_ACTBenchmark_AIG,ACTScience_ACTBenchmark_AIG,ACTSubtests_BenchmarksMet_AIG,ACTWorkKeys_SilverPlus_AIG,ACTWriting_ACTBenchmark_AIG,EOCBiology_CACR_AIG,EOCBiology_GLP_AIG,EOCEnglish2_CACR_AIG,EOCEnglish2_GLP_AIG,EOCMathI_CACR_AIG,EOCMathI_GLP_AIG,EOCSubjects_CACR_AIG,EOCSubjects_GLP_AIG,EOG/EOCSubjects_CACR_AIG,EOG/EOCSubjects_GLP_AIG,EOGGr6_CACR_AIG,EOGGr6_GLP_AIG,EOGGr7_CACR_AIG,EOGGr7_GLP_AIG,EOGGr8_CACR_AIG,EOGGr8_GLP_AIG,EOGMathGr3-8_CACR_AIG,EOGMathGr3-8_GLP_AIG,EOGMathGr6_CACR_AIG,EOGMathGr6_GLP_AIG,EOGMathGr7_CACR_AIG,EOGMathGr7_GLP_AIG,EOGMathGr8_CACR_AIG,EOGMathGr8_GLP_AIG,EOGReadingGr3-8_CACR_AIG,EOGReadingGr3-8_GLP_AIG,EOGReadingGr6_CACR_AIG,EOGReadingGr6_GLP_AIG,EOGReadingGr7_CACR_AIG,EOGReadingGr7_GLP_AIG,EOGReadingGr8_CACR_AIG,EOGReadingGr8_GLP_AIG,EOGScienceGr5&8_CACR_AIG,EOGScienceGr5&8_GLP_AIG,EOGScienceGr8_CACR_AIG,EOGScienceGr8_GLP_AIG,GraduationRate_4yr_AIG,GraduationRate_5yr_AIG,ACT_pTarget_PctMet,ACTWorkKeys_pTarget_PctMet,CurrentYearEOC_pTarget_PctMet,MathGr10_pTarget_PctMet,ReadingGr10_pTarget_PctMet,ReadingGr3-8_pTarget_PctMet,SciGr11_pTarget_PctMet,SciGr5&8_pTarget_PctMet,TotalTargets_pTarget_PctMet,sat_avg_score_num,lea_sat_avg_score_num,sat_participation_pct,lea_sat_participation_pct,ap_participation_pct,lea_ap_participation_pct,ap_pct_3_or_above,lea_ap_pct_3_or_above,ib_participation_pct,ib_pct_4_or_above,lea_ib_pct_4_or_above,total_specialized_courses,ap_ib_courses,cte_courses,univ_college_courses,lea_total_specialized_courses,lea_ap_ib_courses,lea_cte_courses,lea_univ_college_courses,st_total_specialized_courses,st_ap_ib_courses,st_cte_courses,st_univ_college_courses,ALL_All Students (Total or Subtotal_ENROLL_sch_pct,ECODIS_Economically Disadvantaged_ENROLL_sch_pct,F_Female_ENROLL_sch_pct,LEP_Limited English Proficiency_ENROLL_sch_pct,M_Male_ENROLL_sch_pct,MA_Asian_ENROLL_sch_pct,MAN_American Indian_ENROLL_sch_pct,MB_Black_ENROLL_sch_pct,MHL_Hispanic_ENROLL_sch_pct,MM_Multiracial_ENROLL_sch_pct,MW_White_ENROLL_sch_pct,avg_daily_attend_pct,crime_per_c_num,short_susp_per_c_num,long_susp_per_c_num,expelled_per_c_num,stud_internet_comp_num,lea_avg_daily_attend_pct,lea_crime_per_c_num,lea_short_susp_per_c_num,lea_long_susp_per_c_num,lea_expelled_per_c_num,lea_stud_internet_comp_num,digital_media_pct,avg_age_media_collection,books_per_student,lea_avg_age_media_collection,lea_books_per_student,wap_num,wap_per_classroom,lea_wap_num,lea_wap_per_classroom,flicensed_teach_pct,tchyrs_0thru3_pct,tchyrs_4thru10_pct,tchyrs_11plus_pct,class_teach_num,nbpts_num,advance_dgr_pct,_1yr_tchr_trnovr_pct,emer_prov_teach_pct,lateral_teach_pct,highqual_class_pct,lea_flicensed_teach_pct,lea_tchyrs_0thru3_pct,lea_tchyrs_4thru10_pct,lea_tchyrs_11plus_pct,lea_class_teach_num,lea_nbpts_num,lea_advance_dgr_pct,lea_1yr_tchr_trnovr_pct,lea_emer_prov_teach_pct,lea_lateral_teach_pct,lea_highqual_class_hp_pct,lea_highqual_class_lp_pct,lea_highqual_class_all_pct,lea_not_highqual_class_hp_pct,lea_not_highqual_class_lp_pct,lea_not_highqual_class_all_pct,st_tchyrs_0thru3_pct,st_1yr_tchr_trnovr_pct,st_emer_prov_teach_pct,st_lateral_teach_pct,st_prin_white_pct,0-3 Years_Exp_Pct_Tch,10+ Years_Exp_Pct_Tch,4-10 Years_Exp_Pct_Tch,0-3 Years_LEA_Exp_Pct_Prin,10+ Years_LEA_Exp_Pct_Prin,4-10 Years_LEA_Exp_Pct_Prin,Accomplished_TCHR_Standard 1_Pct,Accomplished_TCHR_Standard 2_Pct,Accomplished_TCHR_Standard 3_Pct,Accomplished_TCHR_Standard 4_Pct,Accomplished_TCHR_Standard 5_Pct,Developing_TCHR_Standard 1_Pct,Developing_TCHR_Standard 2_Pct,Developing_TCHR_Standard 3_Pct,Developing_TCHR_Standard 4_Pct,Developing_TCHR_Standard 5_Pct,Distinguished_TCHR_Standard 1_Pct,Distinguished_TCHR_Standard 2_Pct,Distinguished_TCHR_Standard 3_Pct,Distinguished_TCHR_Standard 4_Pct,Distinguished_TCHR_Standard 5_Pct,Does Not Meet Expected Growth_TCHR_Student Growth_Pct,Exceeds Expected Growth_TCHR_Student Growth_Pct,Meets Expected Growth_TCHR_Student Growth_Pct,Not Demostrated_TCHR_Standard 1_Pct,Not Demostrated_TCHR_Standard 2_Pct,Not Demostrated_TCHR_Standard 3_Pct,Not Demostrated_TCHR_Standard 4_Pct,Not Demostrated_TCHR_Standard 5_Pct,Proficient_TCHR_Standard 1_Pct,Proficient_TCHR_Standard 2_Pct,Proficient_TCHR_Standard 3_Pct,Proficient_TCHR_Standard 4_Pct,Proficient_TCHR_Standard 5_Pct,AsianFemalePct,AsianMalePct,AsianPct,BlackFemalePct,BlackMalePct,BlackPct,HispanicFemalePct,HispanicMalePct,HispanicPct,IndianFemalePct,IndianMalePct,IndianPct,PacificIslandFemalePct,PacificIslandMalePct,PacificIslandPct,TwoOrMoreFemalePct,TwoOrMoreMalePct,TwoOrMorePct,SPG Grade_A,SPG Grade_A+NG,SPG Grade_B,SPG Grade_C,SPG Grade_D,SPG Grade_F,EVAAS Growth Status_Exceeded,EVAAS Growth Status_Met,EVAAS Growth Status_NotMet
0.33299999999999996,12.0,11.0,0.917,12.0,0.0,0.0,0.083,0.25,0.33299999999999996,16.0,0.56,178.0,0.46,74.0,0.76,36.0,0.69,68.0,0.37,5.0,0.4,969.0,483.0,0.498,30.0,0.4,79.0,0.41,162.0,0.43,205.0,0.49,116.0,0.6,0.304,46.0,46.0,1.0,46.0,0.0,0.043,0.0,0.261,0.304,0.34,98.0,95.0,0.9690000000000001,97.0,0.0,0.01,0.01,0.32,0.34,0.3,42.0,30.0,0.7140000000000001,30.0,0.0,0.0,0.3,0.3,87.0,0.8,121.0,0.81,208.0,168.0,0.8079999999999999,1899.0,619.3333333333334,224.0,729.0,4150.0,2355.0,8801.0,14275.0,1160.0,748.0,580.0,0.775,0.74,0.71,0.75,0.7,55.0,0.91,207.0,0.84,318.0,0.75,124.0,0.65,33.0,0.85,11.0,0.82,45.0,0.73,49.0,0.65,250.0,0.84,206.0,0.76,85.0,0.79,55.0,0.73,34.0,0.79,24.0,0.63,0.268,125.0,111.0,0.888,112.0,0.054000000000000006,0.188,0.027000000000000003,0.0,0.268,0.53,112.0,98.0,0.875,100.0,0.0,0.0,0.53,0.53,0.332,398.0,361.0,0.907,374.0,0.016,0.096,0.032,0.187,0.332,0.24100000000000002,116.0,104.0,0.897,108.0,0.0,0.0,0.009000000000000001,0.231,0.24100000000000002,14.0,0.865,0.9400000000000001,0.9,0.9533333333333333,11.75,0.8524999999999999,0.96,0.9766666666666667,0.9833333333333334,13.25,0.8500000000000001,0.9766666666666667,0.9433333333333334,7.05,0.7564285714285713,0.856153846153846,0.828125,0.9046153846153846,4.0,0.595,11.0,0.8200000000000001,0.95,14.35,0.9505555555555555,0.9364999999999999,0.946,0.9431578947368422,6.0,0.83,0.5806250000000001,0.2,0.6105263157894738,7.0,0.86,0.975,0.9077777777777778,1.0,18.0,0.89,0.88,0.79,0.9,10.833333333333334,0.8906250000000001,0.8190909090909091,0.9099999999999999,0.87125,1.7857142857142858,8.411764705882353,0.8466666666666668,0.8542857142857142,0.7909090909090909,0.7987500000000001,34.0,0.82,0.73,0.92,0.76,36.0,0.81,0.81,0.96,0.93,59.0,0.69,0.68,0.78,0.74,11.0625,0.4976923076923076,0.6823076923076924,0.6009999999999999,0.7185714285714285,8.0,0.38,0.8,0.88,0.78,18.0,0.8200000000000002,0.8942857142857144,0.8866666666666666,0.8842857142857142,16.0,0.9262499999999999,0.895,0.9133333333333334,0.7979999999999999,19.323529411764707,0.9570588235294117,0.913,0.94,0.8965000000000002,38.0,0.79,0.88,0.86,0.81,10.0,0.97,0.43,273.0,243.0,0.89,249.0,0.07200000000000001,0.11599999999999999,0.052000000000000005,0.008,0.18100000000000002,0.43,0.28300000000000003,330.0,280.0,0.848,283.0,0.0,0.004,0.27899999999999997,0.28300000000000003,0.27,312.0,279.0,0.894,285.0,0.011000000000000001,0.032,0.042,0.18600000000000003,0.27,0.46399999999999997,57.0,54.0,0.9470000000000001,56.0,0.018000000000000002,0.0,0.446,0.46399999999999997,0.498,0.626,0.41100000000000003,0.775,0.441,0.767,0.8079999999999999,3.0,1.0,3.0,0.0,738.0,553.0,462.0,0.626,0.58,0.57,0.5,738.0,391.0,303.0,0.41100000000000003,0.33,0.33,0.29,9.0,0.89,201.0,0.64,312.0,0.69,164.0,0.53,37.0,0.41,15.0,0.47,9.0,0.89,201.0,0.49,312.0,0.46,164.0,0.23,37.0,0.3,15.0,0.2,493,162,32.9,331,67.1,386.0,208.0,53.9,178.0,46.1,67.0,24,35.8,43,64.2,453,232,221,48.8,678,1059,863,2599,567,397,316,131,1467,91,1648.0,5,3740,114,43,71,1,5,9,15,1,77,4,2,0,2795,28,103,781,555,2,2541,29,183,114,63,43,3813.0,3620.0,2372.0,93.0,5374.0,0.0,51.0,15.0,0.0,0.0,8.0,96.0,39.0,0.0,19.0,427.0,1050.0,1128.0,0.0,73.0,277.0,320.0,829.0,34.0,780.0,49.0,82.0,192.0,0.0,2.0,114.0,40.0,414.0,31.0,728.0,9.0,33.0,7.0,0.0,0.0,9.0,22.0,51.0,0.0,46.0,0.0,54.0,93.0,0.0,0.0,54.0,20.0,178.0,31.0,407.0,3228.0,6819.0,4474.0,50.0,308.0,4172.0,4103.0,3524.0,158.0,6716.0,12.0,23.0,13.0,7.0,0.0,11.0,14.0,55.0,0.0,68.0,2780.0,5608.0,3218.0,43.0,235.0,73700.0,31730.0,26460.0,14080.0,33460.0,145510.0,49640.0,2380.0,2030.0,350.0,360.0,1240.0,12820.0,17320.0,3801296.0,73690.0,3849231.0,63020.0,2831746.0,19340.0,18733.0,10780.0,57814.0,10050.0,45728.0,8290.0,6164.0,10760.0,106356.0,9180.0,89366.0,7860.0,114113.0,14090.0,284038.0,710.0,1090.0,2920.0,10380.0,140727.0,2860.0,150107.0,16470.0,47935.0,1800.0,454.0,210.0,4588.0,1760.0,10734.0,1260.0,5293.0,5000.0,5130.0,610.0,1251.0,140.0,2633.0,19710.0,425832.0,2070097.0,4940.0,49686.0,17820.0,101897.0,1500.0,1337.0,17380.0,41118.0,14780.0,5229.0,19660.0,150940.0,15240.0,99512.0,330.0,1285.0,1030.0,485.0,2730.0,3285.0,360.0,929.0,16350.0,85156.0,4280.0,31503.0,230.0,952.0,55770.0,2429206.0,55820.0,416351.0,830.0,3714.0,2140.0,1855.0,23840.0,25074.0,2610.0,531.0,3920.0,1927.0,4120.0,4310.0,6280.0,1097.0,12950.0,15021.0,1100.0,465.0,8400.0,19800.0,3890.0,20190.0,4260.0,22228.0,2820.0,1935.0,70890.0,532181.0,16460.0,40595.0,14360.0,35703.0,11850.0,15661.0,4010.0,3385.0,1500.0,859.0,49210.0,391047.0,53760.0,419050.0,590.0,942.0,720.0,2292.0,13290.0,48075.0,58020.0,150599.0,28880.0,19790.0,10120.0,6220.0,7190.0,1500.0,10370.55668309655,27248.99391127863,1162.324151928095,985.0,0.0,20.79370832125254,20.80371122064366,20.68280661061177,8517.96,0.631,0.212,0.07400000000000001,0.07400000000000001,0.009000000000000001,1155.92,1832.54,5529.5,0.62,2172.86,66.03638735865468,83.40917657291969,61.80617570310235,51.1249637576109,48.95897361554074,48.07465932154248,50.87054218614091,70.90011597564512,92.72064366483039,83.50449405624819,50.71075674108437,33.37579008408234,22.52100608872137,24.07892142650043,17.39351986082923,24.2456509133082,69.52822557262974,23.89001159756451,39.34424470861119,48.15191359814439,39.46398956219193,48.91838213975064,38.88273412583357,51.21720788634386,39.19769498405334,49.3663670629168,39.19769498405334,49.3663670629168,0.0,0.0,0.0,0.0,0.0,0.0,0.0,0.0,0.0,0.0,83.41775877065817,86.22313714120034,54.69681066975936,37.71446796172803,22.40276891852711,25.72144099739055,17.71014786894752,26.15582777616701,68.02323861988982,27.19256306175703,36.60394317193389,47.11886053928675,44.2267323861989,54.17119454914467,39.81800521890403,51.12550014496956,40.29193969266455,50.83374891272832,40.29193969266455,50.83374891272832,0.0,0.0,0.0,0.0,0.0,0.0,0.0,0.0,0.0,0.0,0.0,0.0,0.0,87.13454624528849,87.88773557552913,46.60801681646854,28.81477239779646,22.72786314873876,22.21583067555813,17.17429689765149,22.21082922586257,70.90337779066397,19.74283850391418,41.83482168744564,49.18647434038853,35.09788344447666,44.19963757610901,38.0305305885764,51.2801246738185,38.21849811539577,48.15427660191359,38.21849811539577,48.15427660191359,0.0,0.0,0.0,0.0,0.0,0.0,0.0,0.0,0.0,79.74885474050451,84.51052478979416,0.0,0.0,0.0,0.0,0.0,14.11423601043781,0.0,0.0,0.0,0.0,0.0,0.0,0.0,0.0,0.0,0.0,0.0,0.0,0.0,0.0,0.0,0.0,0.0,0.0,0.0,35.55273992461583,0.0,0.0,9.149173673528558,10.67683386488837,10.07248477819658,11.75123224122934,0.0,0.0,45.27516671498986,48.14182371701943,45.27516671498986,48.14182371701943,0.0,0.0,0.0,0.0,0.0,0.0,0.0,0.0,0.0,0.0,0.0,0.0,0.0,16.78747463032763,30.57590605972746,15.32918237170194,12.966077123804,10.96917947231082,5.510713250217455,12.27273122644245,31.71720788634387,14.67171643954769,23.34901420701653,32.02344157726877,23.42655842273123,31.87249927515222,24.29939112786315,39.56068425630617,23.63169034502754,34.29088141490286,23.63169034502754,34.29088141490286,0.0,0.0,0.0,0.0,0.0,0.0,0.0,0.0,0.0,0.0,0.0,0.0,0.0,0.0,0.0,0.0,0.0,0.0,0.0,0.0,0.0,0.0,0.0,0.0,0.0,0.0,0.0,0.0,84.23308205276892,84.93383589446216,42.21149608582198,18.10603073354595,11.75060887213685,13.61535227602204,10.14318643084952,14.36074224412873,77.28113946071326,16.35195708901131,28.69594085242099,38.62399246158307,29.78711220643665,40.23305305885764,29.67294868077704,44.57297767468832,30.51423601043781,42.48142939982604,30.51423601043781,42.48142939982604,0.0,0.0,0.0,0.0,0.0,0.0,0.0,0.0,0.0,0.0,0.0,0.0,0.0,0.0,0.0,0.0,0.0,0.0,0.0,0.0,0.0,0.0,0.0,0.0,0.0,0.0,76.0499275152218,80.27331110466802,19.64715859669469,17.30066685995941,8.735865468251667,9.232545665410264,7.5537982023775,26.31552623948971,0.0,12.09336039431719,25.93063206726588,33.81246738184981,40.9050884314294,49.07229631777326,28.33572049869527,40.1953174833285,36.85389968106698,47.0775442157147,36.85389968106698,47.0775442157147,0.0,0.0,0.0,0.0,0.0,0.0,0.0,0.0,0.0,0.0,0.0,0.0,50.47055668309655,0.0,53.14257755871268,40.07670339228763,25.72354305595825,27.69757900840824,20.7919251957089,33.91093070455204,62.38119744853581,26.55368222673238,52.64217164395477,60.67993621339519,49.70200057987822,59.43319802841404,47.5324441867208,57.23342997970426,49.85706001739635,58.93863438677878,49.85706001739635,58.93863438677878,0.0,0.0,0.0,0.0,0.0,0.0,0.0,0.0,0.0,0.0,80.81288779356336,85.43744563641636,35.78258915627718,19.5614670919107,11.1042041171354,12.35060887213685,8.685821977384748,13.3711655552334,66.51620759640475,13.34463612641345,28.62255726297477,37.55311684546245,27.42406494636126,37.17144099739055,27.34134531748333,39.9631632357205,27.80329080893013,38.25552334009858,27.80329080893013,38.25552334009858,0.0,0.0,0.0,0.0,0.0,0.0,0.0,0.0,0.0,0.0,0.0,0.0,0.0,0.0,0.0,0.0,76.97757320962599,82.93557552913887,0.0,0.0,0.0,0.9253261815018845,0.0,1.721513482168745,0.0,4.144418672078864,4.743925775587127,0.794998550304436,2.869599884024355,5.250391417802261,13.16651203247318,5.150652363003768,11.18169034502754,5.150652363003768,11.18169034502754,0.0,0.0,0.0,0.0,0.0,0.0,0.0,0.0,0.0,0.0,0.0,0.0,0.0,0.0,0.0,0.0,0.0,0.0,0.0,0.0,0.0,0.0,0.0,0.0,0.0,0.0,0.0,0.0,2.293766309075095,16.0164830385619,16.37773267613801,6.612191939692663,1.305566830965497,5.847941432299217,2.5347347057118,2.011278631487388,5.049985503044361,1.358495216004639,9.702073064656421,14.12349956509133,6.728327051319223,8.328631487387648,6.419599884024355,13.36335169614381,7.606465642215135,11.44408524209916,7.606465642215135,11.44408524209916,0.0,0.0,0.0,0.0,0.0,0.0,0.0,0.0,0.0,0.0,0.0,0.0,0.0,0.0,0.0,0.0,0.0,0.0,0.0,0.0,0.0,0.0,0.0,0.0,0.0,0.0,0.0,66.26049579588287,71.28315453754712,94.14404175123225,75.48883734415773,67.02754421571471,65.33477819657872,50.15558132792114,63.79147579008408,83.74099739054799,54.93596694694114,87.53911278631486,95.1598144389678,87.0538706871557,93.32178892432589,91.40301536677298,96.58160336329371,87.77866048129894,96.19750652363004,87.77866048129894,96.19750652363004,0.0,0.0,0.0,0.0,0.0,0.0,0.0,0.0,0.0,0.0,0.0,0.0,0.0,0.0,0.0,0.0,0.0,0.0,0.0,0.0,0.0,0.0,0.0,0.0,0.0,0.0,97.75263844592635,98.4343287909539,0.8548519860829226,0.6820092780516092,0.9855336329370833,0.9238286459843432,0.7788166135111627,0.0,0.984343287909539,0.0,0.9066458393737314,956.001884604233,961,0.5174731806320674,0.51,0.1514221513482169,0.15,0.3363699623079153,0.3700000000000001,0.0,0.0,0.0,0.0,0.0,0.0,0.0,0.0,0.0,0.0,0.0,0.0,0.0,0.0,0.0,52.18786159657308,16.49452700795558,29.00912001516355,0.0,23.17874158140953,0.0,0.0,10.30716455065488,5.286836394065455,0.0,31.13883726741815,0.9280059437518121,0.9570513192229633,12.36786314873877,0.2315729196868658,0.0,1.298369092490577,0.9410000000000001,0.96,12.37,0.23,0.0,1.24,0.004737605102928385,1963.505943751812,8.484210110844385,1999,14.24,70.44012757320962,1.121983183531458,1380,0.9200000000000002,0.9107486227892143,0.2415585677007829,0.2491269933314004,0.508622064366483,69.43461873006669,6.563786604812989,0.2208892432589156,0.1249533198028414,0.0,0.0846104668019716,0.8876354015656711,0.903,0.242,0.24,0.518,54.0,5.0,0.211,0.13,0.0,0.093,0.924,0.9140000000000001,0.9400000000000002,0.07600000000000001,0.086,0.06000000000000011,0.231,0.148,0.003,0.092,0.7369999999999999,0.2415585677007829,0.508622064366483,0.2491269933314004,0.417,0.167,0.417,0.5078008118295158,0.5218450275442157,0.4419131632357205,0.5527926935343578,0.4133418382139751,0.02432661641055378,0.03163496665700203,0.01427689185271093,0.02480849521600464,0.02659872426790374,0.1186839663670629,0.05211278631487388,0.03959234560742244,0.05340403015366772,0.02518585097129603,0.1915388518411134,0.2504457813859089,0.5583861988982313,0.0,0.00443113946071325,0.002215569730356625,0.0,0.01120817628298057,0.3494447665990142,0.3898457523919976,0.502090316033633,0.3688792403595245,0.5235350826326471,0.006214161473418703,0.007776317435869429,0.01399047890928813,0.1023449960306856,0.1218737978362364,0.224218793866922,0.1063080664733137,0.1049395007163528,0.2112475671896666,0.002097961500301036,0.001969143172484347,0.004067104672785382,0.0004228265324658038,0.0008479672993250821,0.001270793831790886,0.0209757137401977,0.01780971896719399,0.03878543270739169,0.015656712090461,0.0,0.0,0.984343287909539,0.0,0.0,0.5168164685416062,0.3076253986662801,0.1755581327921137
